<?xml version="1.0" encoding="UTF-8"?>
<appvet:ToolServiceAdapter xmlns:appvet="http://csrc.nist.gov/groups/SNS/appvet" xmlns:xsi="http://www.w3.org/2001/XMLSchema-instance" xsi:schemaLocation="http://csrc.nist.gov/groups/SNS/appvet ToolServiceAdapter.xsd ">
  <appvet:Description>
    <appvet:Name>Registration</appvet:Name>
    <appvet:Id>registration</appvet:Id>
    <appvet:ReportFile>HTML</appvet:ReportFile>
  </appvet:Description>
  <appvet:Protocol>
    <appvet:Type>INTERNAL</appvet:Type>
    <appvet:Internal/>
  </appvet:Protocol>
</appvet:ToolServiceAdapter>