<?xml version="1.0" encoding="UTF-8"?>

<appvet:ToolServiceAdapter xmlns:appvet="http://csrc.nist.gov/projects/appvet"
	xmlns:xsi="http://www.w3.org/2001/XMLSchema-instance"
	xsi:schemaLocation="http://csrc.nist.gov/projects/appvet ToolServiceAdapter.xsd ">

	<appvet:Description>
		<appvet:Name>MasterKey ExtraField Test</appvet:Name>
		<appvet:Id>masterkeyextrafield</appvet:Id>
		<appvet:VendorName>NIST</appvet:VendorName>
    <appvet:VendorWebsite>https://appsec.nist.gov/android-masterkey-extrafield-test</appvet:VendorWebsite>

		<appvet:ReportFile>HTML</appvet:ReportFile>
	</appvet:Description>

	<appvet:Protocol>
		<appvet:Type>ASYNCHRONOUS</appvet:Type>
		<appvet:Asynchronous>
			<appvet:Request>
				<appvet:URL>http://129.6.52.146/android-masterkey-extrafield-test/AsynchronousService
				</appvet:URL>
				<appvet:Method>POST</appvet:Method>


				<appvet:Parameter>
					<appvet:Name>appid</appvet:Name>
					<appvet:Value>APPVET_DEFINED</appvet:Value>
				</appvet:Parameter>

				<appvet:Parameter>
					<appvet:Name>file</appvet:Name>
					<appvet:Value>APP_FILE</appvet:Value>
				</appvet:Parameter>

			</appvet:Request>

			<appvet:Response />


		


		</appvet:Asynchronous>

	</appvet:Protocol>

</appvet:ToolServiceAdapter>
